,paper_id,authors,text
25,xml_output_grobid_python_client\Antim&#xfc;llerian-hormone-is-not-associated-with-,"[{'first': 'Yael', 'middle': ['R'], 'last': 'Stovezky', 'suffix': '', 'affiliation': {'laboratory': '', 'institution': 'Cornell University', 'location': {'settlement': 'New York', 'region': 'New York'}}, 'email': ''}, {'first': 'Phillip', 'middle': ['A'], 'last': 'Romanski', 'suffix': '', 'affiliation': {}, 'email': ''}, {'first': 'Pietro', 'middle': [], 'last': 'Bortoletto', 'suffix': '', 'affiliation': {}, 'email': ''}, {'first': 'Steven', 'middle': ['D'], 'last': 'Spandorfer', 'suffix': '', 'affiliation': {}, 'email': ''}]",antimllerian hormone is not associated with embryo ploidy in patients with and without infertility undergoing in vitro fertilization with preimplantation genetic testing objective to assess the association between antim ullerian hormone amh and embryo ploidy rates in cohorts of patients undergoing in vitro fertilization ivf with trophectoderm biopsy for preimplantation genetic testing for aneuploidy pgta the general population of women pursuing ivf with pgta infertile cohort and women pursuing ivf with preimplantation genetic testing for monogenic disorders pgtm owing to the risk of hereditary monogenic diseases noninfertile cohortdesign retrospective cohort studysetting academic centerpatients patients undergoing their first cycle of ivf with trophectoderm biopsy and pgta or pgta and pgtm in our center between march and june patients of advanced maternal age according to the bologna criteria age r years and patients who underwent fresh embryo transfers were excludedinterventions nonemain outcome measures proportion of euploid mosaic and aneuploid embryos per cycle results infertile n and noninfertile n patients were stratified on the basis of amh levels with lowamh defined as ngml in accordance with the bologna criteriaageadjusted regression models showed no relationship between amh classification and proportion of euploid mosaic and aneuploid embryos in the infertile or noninfertile cohortsin the infertile cohort no association between amh classification and embryo ploidy rates was identified in a subgroup analysis of patients aged years years and yearsthese findings persisted in a sensitivity analysis of infertile patients stratified into amh ngml quartile categories no association was found between amh and the proportion of euploid mosaic or aneuploid embryos in large cohorts of patients undergoing ivf with pgta infertile patients or pgta and pgtm noninfertile patients suggesting that a quantitative depletion of ovarian reserve does not predict the ploidy status of the embryo cohort
26,"xml_output_grobid_python_client\Apples,-oranges,-and-ectopic-pregnancies_2023_fns","[{'first': 'Jessica', 'middle': ['A'], 'last': 'Meyer', 'suffix': '', 'affiliation': {'laboratory': '', 'institution': 'NYU Langone Health', 'location': {'settlement': 'New York'}}, 'email': ''}, {'first': 'Gwendolyn', 'middle': ['P'], 'last': 'Quinn', 'suffix': '', 'affiliation': {'laboratory': '', 'institution': 'NYU Langone Health', 'location': {'settlement': 'New York'}}, 'email': ''}, {'first': 'Christina', 'middle': ['A'], 'last': 'Penfield', 'suffix': '', 'affiliation': {'laboratory': '', 'institution': 'NYU Langone Health', 'location': {'settlement': 'New York'}}, 'email': ''}]",apples oranges and ectopic pregnancies
27,xml_output_grobid_python_client\Are-sperm-human-papilloma-virus-infections-a-missi,"[{'first': 'Richard', 'middle': ['J'], 'last': 'Fantus', 'suffix': '', 'affiliation': {'laboratory': '', 'institution': 'University of Kansas Medical Center', 'location': {'settlement': 'Kansas City', 'region': 'Kansas'}}, 'email': ''}, {'first': 'Ajay', 'middle': ['K'], 'last': 'Nangia', 'suffix': '', 'affiliation': {'laboratory': '', 'institution': 'University of Kansas Medical Center', 'location': {'settlement': 'Kansas City', 'region': 'Kansas'}}, 'email': ''}, {'first': 'Joshua', 'middle': ['A'], 'last': 'Halpern', 'suffix': '', 'affiliation': {'laboratory': '', 'institution': 'Northwestern University Feinberg School of Medicine', 'location': {'settlement': 'Chicago', 'region': 'Illinois'}}, 'email': ''}]",are sperm human papilloma virus infections a missing link for idiopathic recurrent pregnancy loss
28,"xml_output_grobid_python_client\Ascending-toward-a-30,000-foot-view-of-uterus-tran","[{'first': 'Rebecca', 'middle': ['K'], 'last': 'Chung', 'suffix': '', 'affiliation': {'laboratory': '', 'institution': 'University Hospitals Cleveland Medical Center', 'location': {'settlement': 'Beachwood', 'region': 'Ohio'}}, 'email': ''}, {'first': 'Elliott', 'middle': ['G'], 'last': 'Richards', 'suffix': '', 'affiliation': {'laboratory': '', 'institution': 'Cleveland Clinic', 'location': {'settlement': 'Cleveland', 'region': 'Ohio'}}, 'email': ''}, {'first': 'Ruth', 'middle': [], 'last': 'Farrell', 'suffix': '', 'affiliation': {'laboratory': '', 'institution': 'Cleveland Clinic', 'location': {'settlement': 'Cleveland', 'region': 'Ohio'}}, 'email': ''}, {'first': 'Rebecca', 'middle': ['L'], 'last': 'Flyckt', 'suffix': '', 'affiliation': {'laboratory': '', 'institution': 'University Hospitals Cleveland Medical Center', 'location': {'settlement': 'Beachwood', 'region': 'Ohio'}}, 'email': ''}]",ascending toward a foot view of uterus transplant
29,xml_output_grobid_python_client\Assisted-reproductive-technology--considerations-f,"[{'first': 'Nicholas', 'middle': ['Saleem'], 'last': 'Raja', 'suffix': '', 'affiliation': {}, 'email': ''}, {'first': 'Colin', 'middle': ['B'], 'last': 'Russell', 'suffix': '', 'affiliation': {'laboratory': '', 'institution': 'University of Michigan', 'location': {'settlement': 'Ann Arbor', 'region': 'Michigan'}}, 'email': ''}, {'first': 'Molly', 'middle': ['B'], 'last': 'Moravek', 'suffix': '', 'affiliation': {'laboratory': '', 'institution': 'University of Michigan', 'location': {'settlement': 'Ann Arbor', 'region': 'Michigan'}}, 'email': ''}]",assisted reproductive technology considerations for the nonheterosexual population and single parents this study aimed to discuss fertility concerns unique to the lesbian gay bisexual transgender queer plus and singleparenttobe populations and review special considerations regarding the evaluation and treatment of these patients relevant to the practicing reproductive medicine providerthe use of assisted reproductive technology has rapidly increased over the past yearsgiven these trends providers can expect a greater diversity of patients making use of these technologiesboth the lesbian gay bisexual transgender queer plus community and single parentstobe represent understudied and important populations who often require the use of assisted reproductive technology to build their familiesthe american society for reproductive medicine advocates for equitable treatment of patients regardless of sexual orientation and partner status and health care providers working in the fertility field should be comfortable and confident in assessing the needs of and providing care to these populations
30,xml_output_grobid_python_client\Association-of-endometriosis-and-adenomyosis-with-,"[{'first': 'Paolo', 'middle': [], 'last': 'Vercellini', 'suffix': '', 'affiliation': {'laboratory': '', 'institution': 'Universit a degli Studi', 'location': {'settlement': 'Milano', 'country': 'Italy'}}, 'email': 'paolo.vercellini@unimi.it'}, {'first': 'Paola', 'middle': [], 'last': 'Viganò', 'suffix': '', 'affiliation': {}, 'email': ''}, {'first': 'Veronica', 'middle': [], 'last': 'Bandini', 'suffix': '', 'affiliation': {'laboratory': '', 'institution': 'Universit a degli Studi', 'location': {'settlement': 'Milano', 'country': 'Italy'}}, 'email': ''}, {'first': 'Laura', 'middle': [], 'last': 'Buggio', 'suffix': '', 'affiliation': {'laboratory': '', 'institution': ""Fondazione IRCCS Ca' Granda Ospedale Maggiore Policlinico"", 'location': {'settlement': 'Milano', 'country': 'Italy'}}, 'email': ''}, {'first': 'Nicola', 'middle': [], 'last': 'Berlanda', 'suffix': '', 'affiliation': {'laboratory': '', 'institution': ""Fondazione IRCCS Ca' Granda Ospedale Maggiore Policlinico"", 'location': {'settlement': 'Milano', 'country': 'Italy'}}, 'email': ''}, {'first': 'Edgardo', 'middle': [], 'last': 'Somigliana', 'suffix': '', 'affiliation': {'laboratory': '', 'institution': 'Universit a degli Studi', 'location': {'settlement': 'Milano', 'country': 'Italy'}}, 'email': ''}]",association of endometriosis and adenomyosis with pregnancy and infertility we performed a comprehensive narrative synthesis of systematic reviews with metaanalysis published in the last years on the association of endometriosis and adenomyosis with reproductive and obstetric outcomesthis review aimed to define the information on which to base preconceptional counseling and clarify whether and in which cases pregnant women with endometriosis and adenomyosis should be referred to tertiary care centers and followed as highrisk obstetric patients reduced pregnancy and live birth rates and an increased miscarriage rate were observed in women with endometriosis and adenomyosisthe effect was larger in women with adenomyosis than in those with endometriosiswomen with superficial peritoneal and ovarian endometriosis do not appear to be at considerably increased risk of major obstetric and neonatal complications whereas women with severe endometriosis whether operated or not are at severalfold increased risk of placenta previamoreover deep infiltrating endometriosis is a risk factor for spontaneous hemoperitoneum in pregnancy and is associated with surgical complications at cesarean sectionoverall women with adenomyosis are at increased risk of various adverse obstetric outcomes including preeclampsia preterm delivery fetal malpresentation postpartum hemorrhage low birth weight and small for gestational age most studies included in the considered systematic reviews are characterized by substantial qualitative and quantitative heterogeneitythis makes a reliable assessment of the available evidence difficult and caution should be exercised when attempting to derive clinical indications nevertheless women with deep infiltrating endometriosis and severe adenomyosis should be considered at high obstetric risk and can benefit from referral to tertiary care centers where they can be safely followed through pregnancy and deliverywhether the same should apply also to pregnant women with minimal endometriosis and adenomyosis forms is currently uncertain emerging evidence suggests that some adverse reproductive and obstetric outcomes observed in women with endometriosis are in fact associated with coexisting adenomyosis
31,xml_output_cochrane\Aue-aungkul_et_al-2021-Cochrane_Database_of_Systematic_Reviews,"[{'first': 'Apiwat', 'middle': [], 'last': 'Aue-Aungkul', 'suffix': '', 'affiliation': {}, 'email': ''}, {'first': 'Chumnan', 'middle': [], 'last': 'Kietpeerakool', 'suffix': '', 'affiliation': {}, 'email': ''}, {'first': 'Siwanon', 'middle': [], 'last': 'Rattanakanokchai', 'suffix': '', 'affiliation': {}, 'email': ''}, {'first': 'Khadra', 'middle': [], 'last': 'Galaal', 'suffix': '', 'affiliation': {}, 'email': ''}, {'first': 'Teerayut', 'middle': [], 'last': 'Temtanakitpaisan', 'suffix': '', 'affiliation': {}, 'email': ''}, {'first': 'Chetta', 'middle': [], 'last': 'Ngamjarus', 'suffix': '', 'affiliation': {}, 'email': ''}, {'first': 'Pisake', 'middle': [], 'last': 'Lumbiganon', 'suffix': '', 'affiliation': {}, 'email': ''}]",postoperative interventions for preventing bladder dysfunction after radical hysterectomy in women with earlystage cervical cancer postoperative interventions for preventing bladder dysfunction a
32,xml_output_grobid_python_client\Automated-identification-of-rare-sperm-becomes-pos,"[{'first': 'Lewin', 'middle': [], 'last': 'Staine', 'suffix': '', 'affiliation': {'laboratory': '', 'institution': 'Johns Hopkins University School of Medicine', 'location': {'settlement': 'Baltimore', 'region': 'Maryland'}}, 'email': ''}, {'first': 'Jaden', 'middle': ['R'], 'last': 'Kohn', 'suffix': '', 'affiliation': {'laboratory': '', 'institution': 'Johns Hopkins University School of Medicine', 'location': {'settlement': 'Baltimore', 'region': 'Maryland'}}, 'email': ''}, {'first': 'Taylor', 'middle': ['P'], 'last': 'Kohn', 'suffix': '', 'affiliation': {}, 'email': ''}]",automated identification of rare sperm becomes possible is sperm selection the next frontier in male infertility
33,xml_output_grobid_python_client\Automated-rare-sperm-identification-from-low-magni,"[{'first': 'Ryan', 'middle': [], 'last': 'Lee', 'suffix': '', 'affiliation': {'laboratory': '', 'institution': 'University of British Columbia', 'location': {'settlement': 'Vancouver', 'region': 'British Columbia', 'country': 'Canada'}}, 'email': ''}, {'first': 'Luke', 'middle': [], 'last': 'Witherspoon', 'suffix': '', 'affiliation': {'laboratory': '', 'institution': 'University of British Columbia', 'location': {'settlement': 'Vancouver', 'region': 'British Columbia', 'country': 'Canada'}}, 'email': ''}, {'first': 'Meghan', 'middle': [], 'last': 'Robinson', 'suffix': '', 'affiliation': {'laboratory': '', 'institution': 'University of British Columbia', 'location': {'settlement': 'Vancouver', 'region': 'British Columbia', 'country': 'Canada'}}, 'email': ''}, {'first': 'Jeong', 'middle': ['Hyun'], 'last': 'Lee', 'suffix': '', 'affiliation': {'laboratory': '', 'institution': 'University of British Columbia', 'location': {'settlement': 'Vancouver', 'region': 'British Columbia', 'country': 'Canada'}}, 'email': ''}, {'first': 'Simon', 'middle': ['P'], 'last': 'Duffy', 'suffix': '', 'affiliation': {'laboratory': '', 'institution': 'University of British Columbia', 'location': {'settlement': 'Vancouver', 'region': 'British Columbia', 'country': 'Canada'}}, 'email': ''}, {'first': 'Ryan', 'middle': [], 'last': 'Flannigan', 'suffix': '', 'affiliation': {'laboratory': '', 'institution': 'University of British Columbia', 'location': {'settlement': 'Vancouver', 'region': 'British Columbia', 'country': 'Canada'}}, 'email': 'ryan.flannigan@ubc.ca'}, {'first': 'Hongshen', 'middle': [], 'last': 'Ma', 'suffix': '', 'affiliation': {'laboratory': '', 'institution': 'University of British Columbia', 'location': {'settlement': 'Vancouver', 'region': 'British Columbia', 'country': 'Canada'}}, 'email': ''}]",automated rare sperm identification from lowmagnification microscopy images of dissociated microsurgical testicular sperm extraction samples using deep learning objective to develop a machine learning algorithm to detect rare human sperm in semen and microsurgical testicular sperm extraction microtese samples using brightfield bf microscopy for nonobstructive azoospermia patientsdesign spermatozoa were collected from fertile mentestis biopsies were collected from microtese samples determined to be clinically negative for sperma convolutional neural network based on the unet architecture was trained using bf image patches with fluorescent ground truth image pairs to segment spermthe algorithm was validated using image patchesthe algorithm was tested using image patches containing abundant sperm as well as image patches containing rare spermsetting in vitro fertilization center and university laboratoriespatients normospermic and nonobstructive azoospermia patientsinterventions nonemain outcome measures precision positive predictive value ppv recall sensitivity and fscore of detected sperm locationsresults for spermonly samples our algorithm achieved ppv sensitivity and fscore at magnificationfor dissociated microtese samples doped with an abundant quantity of sperm our algorithm achieved ppv sensitivity and fscorefor dissociated microtese samples doped with rare sperm our algorithm achieved ppv sensitivity and fscoreconclusions rare sperm can be detected in patients testis biopsy samples for potential subsequent use in in vitro fertilizationintracytoplasmic sperm injectiona machine learning algorithm can use bf images at magnification to accurately detect sperm locations using automated imaging
34,"xml_output_grobid_python_client\Awareness,-knowledge,-and-misconceptions-of-adoles","[{'first': 'Abirami', 'middle': [], 'last': 'Kirubarajan', 'suffix': '', 'affiliation': {}, 'email': 'abi.kirubarajan@mail.utoronto.ca'}, {'first': 'Xinglin', 'middle': [], 'last': 'Li', 'suffix': '', 'affiliation': {'laboratory': '', 'institution': 'University of Toronto', 'location': {'settlement': 'Toronto', 'region': 'Ontario', 'country': 'Canada'}}, 'email': ''}, {'first': 'Matthew', 'middle': [], 'last': 'Yau', 'suffix': '', 'affiliation': {'laboratory': '', 'institution': 'University of Toronto', 'location': {'settlement': 'Toronto', 'region': 'Ontario', 'country': 'Canada'}}, 'email': ''}, {'first': 'Caberry', 'middle': [], 'last': 'Yu', 'suffix': '', 'affiliation': {'laboratory': '', 'institution': 'University of Toronto', 'location': {'settlement': 'Toronto', 'region': 'Ontario', 'country': 'Canada'}}, 'email': ''}, {'first': 'Tiffany', 'middle': [], 'last': 'Got', 'suffix': '', 'affiliation': {'laboratory': '', 'institution': 'University of Toronto', 'location': {'settlement': 'Toronto', 'region': 'Ontario', 'country': 'Canada'}}, 'email': ''}, {'first': 'Qixuan', 'middle': [], 'last': 'Li', 'suffix': '', 'affiliation': {'laboratory': '', 'institution': 'University Health Network', 'location': {'settlement': 'Toronto', 'region': 'Ontario', 'country': 'Canada'}}, 'email': ''}, {'first': 'Ella', 'middle': [], 'last': 'Huszti', 'suffix': '', 'affiliation': {'laboratory': '', 'institution': 'University Health Network', 'location': {'settlement': 'Toronto', 'region': 'Ontario', 'country': 'Canada'}}, 'email': ''}, {'first': 'Shannon', 'middle': [], 'last': 'Leung', 'suffix': '', 'affiliation': {'laboratory': '', 'institution': 'University of Toronto', 'location': {'settlement': 'Toronto', 'region': 'Ontario', 'country': 'Canada'}}, 'email': ''}, {'first': 'Nila', 'middle': [], 'last': 'Thangavelu', 'suffix': '', 'affiliation': {'laboratory': '', 'institution': 'McMaster University', 'location': {'settlement': 'Hamilton', 'region': 'Ontario', 'country': 'Canada'}}, 'email': ''}, {'first': 'Mara', 'middle': [], 'last': 'Sobel', 'suffix': '', 'affiliation': {'laboratory': '', 'institution': 'University of Toronto', 'location': {'settlement': 'Toronto', 'region': 'Ontario', 'country': 'Canada'}}, 'email': ''}]",awareness knowledge and misconceptions of adolescents and young people regarding longacting reversible contraceptives a systematic review and metaanalysis objective to assess the awareness knowledge and misconceptions of young people regarding longacting reversible contraceptives larcsdesign we conducted a systematic review in accordance with the preferred reporting items for systematic reviews and metaanalyses guidelines of medlineovid embase and cumulative index to nursing and allied health literaturea randomeffects metaanalysis was performed with formal tests for heterogeneity and publication biasadditional outcomes were summarized using thematic analysissetting not applicablepatients adolescents and young adults aged years with a uterusinterventions not applicablemain outcome measures patientreported outcomes related to awareness knowledge and misconceptions of larcs including intrauterine devices subdermal implants and injections were analyzedresults of the database citations we included studies encompassing adolescents and young peopletwenty studies were eligible for metaanalysisthe pooled prevalence described that only confidence interval ci of participants were aware of at least type of larc i the metaregression noted that the region risk of bias gravidity sexual history previous larc experience and postsecondary education were not associated with awarenessthere were numerous misconceptions regarding eligibility safety and usagenotably ci did not understand that larcs could be used in nulliparous individuals and ci believed that larcs could cause infertility there are notable knowledge gaps among adolescents and young people regarding larcs such as eligibility criteria the reversibility of longacting options and misconceptions regarding infertilityclinicians should specifically counsel regarding the suitability for larcs in nulliparous populations and that larcs do not cause infertility
35,xml_output_cochrane\Ayeleke_et_al-2020-Cochrane_Database_of_Systematic_Reviews,"[{'first': 'Reuben', 'middle': ['Olugbenga'], 'last': 'Ayeleke', 'suffix': '', 'affiliation': {}, 'email': ''}, {'first': 'Joyce', 'middle': ['Danielle'], 'last': 'Asseler', 'suffix': '', 'affiliation': {}, 'email': ''}, {'first': 'Ben', 'middle': ['J'], 'last': 'Cohlen', 'suffix': '', 'affiliation': {}, 'email': ''}, {'first': 'Susanne', 'middle': ['M'], 'last': 'Veltman-Verhulst', 'suffix': '', 'affiliation': {}, 'email': ''}]",intrauterine insemination for unexplained subfertility
36,xml_output_cochrane\Barbosa_et_al-2021-Cochrane_Database_of_Systematic_Reviews,"[{'first': 'Frederico', 'middle': ['T'], 'last': 'Barbosa', 'suffix': '', 'affiliation': {'laboratory': '', 'institution': 'Universidade Federal de São Paulo', 'location': {'settlement': 'Sao Paulo', 'country': 'Brazil'}}, 'email': ''}, {'first': 'Michele', 'middle': ['P'], 'last': 'Silva', 'suffix': '', 'affiliation': {'laboratory': '', 'institution': 'Alcides Carneiro Hospital', 'location': {'settlement': 'Petropolis', 'country': 'Brazil'}}, 'email': ''}, {'first': 'Luís', 'middle': ['Eduardo S'], 'last': 'Fontes', 'suffix': '', 'affiliation': {'laboratory': '', 'institution': 'Cochrane Afilliate Rio de Janeiro', 'location': {'settlement': 'Cochrane, Petrópolis', 'country': 'Brazil'}}, 'email': ''}, {'first': 'Daniela', 'middle': ['V'], 'last': 'Pachito', 'suffix': '', 'affiliation': {'laboratory': '', 'institution': 'Hospital Sirio-Libanês', 'location': {'settlement': 'São Paulo', 'country': 'Brazil'}}, 'email': ''}, {'first': 'Tamara', 'middle': [], 'last': 'Melnik', 'suffix': '', 'affiliation': {'laboratory': '', 'institution': 'Cochrane Brazil', 'location': {'settlement': 'São Paulo', 'country': 'Brazil'}}, 'email': ''}, {'first': 'Rachel', 'middle': [], 'last': 'Riera', 'suffix': '', 'affiliation': {'laboratory': '', 'institution': 'Cochrane Afilliate Rio de Janeiro', 'location': {'settlement': 'Cochrane, Petrópolis', 'country': 'Brazil'}}, 'email': ''}]",noninvasive positive airway pressure therapy for improving erectile dysfunction in men with obstructive sleep apnoea noninvasive positive airway
37,xml_output_cochrane\Barrowclough_et_al-2022-Cochrane_Database_of_Systematic_Reviews,"[{'first': 'Jennifer', 'middle': ['A'], 'last': 'Barrowclough', 'suffix': '', 'affiliation': {}, 'email': ''}, {'first': 'Luling', 'middle': [], 'last': 'Lin', 'suffix': '', 'affiliation': {}, 'email': ''}, {'first': 'Bridget', 'middle': [], 'last': 'Kool', 'suffix': '', 'affiliation': {}, 'email': ''}, {'first': 'G', 'middle': ['Justus'], 'last': 'Hofmeyr', 'suffix': '', 'affiliation': {}, 'email': ''}, {'first': 'Caroline', 'middle': ['A'], 'last': 'Crowther', 'suffix': '', 'affiliation': {}, 'email': ''}]",maternal postures for fetal malposition in labour for improving the health of mothers and their infants
38,xml_output_cochrane\Basheer_et_al-2020-Cochrane_Database_of_Systematic_Reviews,"[{'first': 'Aneesh', 'middle': [], 'last': 'Basheer', 'suffix': '', 'affiliation': {'laboratory': '', 'institution': 'Pondicherry Institute of Medical Sciences', 'location': {'settlement': 'Pondicherry', 'country': 'India'}}, 'email': ''}, {'first': 'Richard', 'middle': [], 'last': 'Kirubakaran', 'suffix': '', 'affiliation': {'laboratory': '', 'institution': 'Christian Medical College', 'location': {'settlement': 'Vellore', 'country': 'India'}}, 'email': ''}, {'first': 'Kevin', 'middle': [], 'last': 'Tan', 'suffix': '', 'affiliation': {'laboratory': '', 'institution': 'National Neuroscience Institute', 'location': {'settlement': 'Singapore', 'country': 'Singapore'}}, 'email': ''}, {'first': 'Venugopalan', 'middle': ['Y'], 'last': 'Vishnu', 'suffix': '', 'affiliation': {'laboratory': '', 'institution': 'All India Institute of Medical Sciences', 'location': {'settlement': 'New Delhi', 'country': 'India'}}, 'email': 'vishnuvy16@yahoo.com'}, {'first': 'Doreen', 'middle': [], 'last': 'Fialho', 'suffix': '', 'affiliation': {'laboratory': '', 'institution': ""King's College Hospital"", 'location': {'settlement': 'London', 'country': 'UK'}}, 'email': ''}]",diseasemodifying therapy for hivrelated distal symmetrical polyneuropathy including antiretroviral toxic neuropathy diseasemodifying therapy
39,xml_output_cochrane\Bergman_et_al-2019-Cochrane_Database_of_Systematic_Reviews,"[{'first': 'Hanna', 'middle': [], 'last': 'Bergman', 'suffix': '', 'affiliation': {}, 'email': ''}, {'first': 'Brian', 'middle': ['S'], 'last': 'Buckley', 'suffix': '', 'affiliation': {}, 'email': ''}, {'first': 'Gemma', 'middle': [], 'last': 'Villanueva', 'suffix': '', 'affiliation': {}, 'email': ''}, {'first': 'Jennifer', 'middle': [], 'last': 'Petkovic', 'suffix': '', 'affiliation': {}, 'email': ''}, {'first': 'Chantelle', 'middle': [], 'last': 'Garritty', 'suffix': '', 'affiliation': {}, 'email': ''}, {'first': 'Vittoria', 'middle': [], 'last': 'Lutje', 'suffix': '', 'affiliation': {}, 'email': ''}, {'first': 'Alina', 'middle': ['Ximena'], 'last': 'Riveros-Balta', 'suffix': '', 'affiliation': {}, 'email': ''}, {'first': 'Nicola', 'middle': [], 'last': 'Low', 'suffix': '', 'affiliation': {}, 'email': ''}, {'first': 'Nicholas', 'middle': [], 'last': 'Henschke', 'suffix': '', 'affiliation': {}, 'email': ''}]",comparison of different human papillomavirus hpv vaccine types and dose schedules for prevention of hpvrelated disease in females and males comparison of di erent human papillomavirus hpv
